{
  "$schema": "./entity-schema.schema.json",
  "version": "3.0.0",
  "created": "2026-03-14T00:00:00Z",
  "entity_types": [
    {
      "index": 0,
      "directory": "00-initial-question",
      "key": "initial-question",
      "prefix": "question",
      "singular": "initial-question",
      "plural": "initial-questions",
      "data_subdir": "data",
      "dedupe": false,
      "required_fields": [],
      "schema_file": "initial-question-entity.schema.json"
    },
    {
      "index": 1,
      "directory": "01-research-dimensions",
      "key": "research-dimensions",
      "prefix": "dimension",
      "singular": "dimension",
      "plural": "dimensions",
      "data_subdir": "data",
      "dedupe": false,
      "required_fields": [],
      "schema_file": "dimension-entity.schema.json"
    },
    {
      "index": 2,
      "directory": "02-refined-questions",
      "key": "refined-questions",
      "prefix": "question",
      "singular": "refined-question",
      "plural": "refined-questions",
      "data_subdir": "data",
      "dedupe": false,
      "required_fields": [],
      "schema_file": "refined-question-entity.schema.json"
    },
    {
      "index": 3,
      "directory": "03-query-batches",
      "key": "query-batches",
      "prefix": "batch",
      "singular": "query-batch",
      "plural": "query-batches",
      "data_subdir": "data",
      "dedupe": false,
      "required_fields": [],
      "schema_file": "query-batch-entity.schema.json"
    },
    {
      "index": 4,
      "directory": "04-findings",
      "key": "findings",
      "prefix": "finding",
      "singular": "finding",
      "plural": "findings",
      "data_subdir": "data",
      "dedupe": false,
      "required_fields": [],
      "schema_file": "finding-entity.schema.json"
    },
    {
      "index": 5,
      "directory": "05-sources",
      "key": "sources",
      "prefix": "source",
      "singular": "source",
      "plural": "sources",
      "data_subdir": "data",
      "dedupe": true,
      "required_fields": ["name", "url", "domain", "title"],
      "schema_file": "source-entity.schema.json"
    },
    {
      "index": 6,
      "directory": "06-claims",
      "key": "claims",
      "prefix": "claim",
      "singular": "claim",
      "plural": "claims",
      "data_subdir": "data",
      "dedupe": false,
      "required_fields": [],
      "schema_file": "claim-entity.schema.json"
    }
  ],
  "special_directories": [".metadata", ".logs", ".locks"],
  "wikilink_pattern_template": "^\\[\\[{directory}/data/{prefix}-[a-z0-9-]+-[a-f0-9]{8}\\]\\]$"
}
